{
  "version": 1,
  "hq": {
    "name": "OMD DESIGN STUDIO (DEMO)",
    "owner": "leeyoojinwork-pm"
  },
  "agents": [
    {
      "id": "master",
      "name": "OMD Master",
      "origin": "Claude",
      "role": "총괄 디자이너",
      "team": "Control",
      "status": "active",
      "task": "요구사항을 디자인 의사결정으로 변환 중",
      "output": "OMD-PLAN.md",
      "load": 91,
      "model": "opus",
      "accent": "amber"
    },
    {
      "id": "orch",
      "name": "Orchestrator",
      "origin": "Claude",
      "role": "워크플로 지휘",
      "team": "Control",
      "status": "active",
      "task": "전문 에이전트 라우팅 · handoff 기록",
      "output": ".orchestrator.log",
      "load": 84,
      "model": "opus",
      "accent": "green"
    },
    {
      "id": "pm",
      "name": "PM Fable",
      "origin": "Claude",
      "role": "프로덕트 매니저",
      "team": "Control",
      "status": "active",
      "task": "MVP 확정 · 마일스톤 추적 · Opus 인수인계 준비",
      "output": "docs/ROADMAP.md",
      "load": 88,
      "model": "fable",
      "accent": "orange"
    },
    {
      "id": "critic",
      "name": "Critic",
      "origin": "Codex",
      "role": "근본 원인 비평",
      "team": "Review",
      "status": "review",
      "task": "표면 패치 반려, 저수준 재진입 지시",
      "output": "critique.md",
      "load": 62,
      "model": "opus",
      "accent": "red"
    },
    {
      "id": "designer",
      "name": "Designer Review",
      "origin": "Claude",
      "role": "브랜드 QA",
      "team": "Review",
      "status": "review",
      "task": "타이포 · 색 · 반응형 품질 감사",
      "output": "designer-review.md",
      "load": 73,
      "model": "opus",
      "accent": "blue"
    },
    {
      "id": "finalqa",
      "name": "Final QA",
      "origin": "Claude",
      "role": "최종 게이트",
      "team": "Review",
      "status": "idle",
      "task": "8개 루브릭 PASS/REVISION 판정 대기",
      "output": "final-qa-round.md",
      "load": 34,
      "model": "opus",
      "accent": "yellow"
    },
    {
      "id": "ui",
      "name": "UI Junior",
      "origin": "Codex",
      "role": "와이어프레임",
      "team": "Design",
      "status": "active",
      "task": "여정 → 화면 구조 변환 작업",
      "output": "wireframes/*.md",
      "load": 77,
      "model": "sonnet",
      "accent": "pink"
    },
    {
      "id": "copy",
      "name": "Microcopy",
      "origin": "Codex",
      "role": "UI 문구",
      "team": "Design",
      "status": "active",
      "task": "버튼 · 오류 · 빈 상태 문구 다듬는 중",
      "output": "microcopy.json",
      "load": 69,
      "model": "sonnet",
      "accent": "purple"
    },
    {
      "id": "asset",
      "name": "Asset Curator",
      "origin": "Claude",
      "role": "에셋 큐레이터",
      "team": "Design",
      "status": "active",
      "task": "아이콘 · 이미지 · 3D 매체 선정",
      "output": "assets/manifest.json",
      "load": 58,
      "model": "sonnet",
      "accent": "green"
    },
    {
      "id": "research",
      "name": "UX Researcher",
      "origin": "Codex",
      "role": "레퍼런스 조사",
      "team": "Research",
      "status": "idle",
      "task": "경쟁 서비스 비교 대기",
      "output": "references-cited.md",
      "load": 41,
      "model": "opus",
      "accent": "blue"
    },
    {
      "id": "persona",
      "name": "Persona Tester",
      "origin": "Claude",
      "role": "가혹한 사용자",
      "team": "Research",
      "status": "review",
      "task": "ABANDON 규칙으로 여정 테스트",
      "output": "persona-feedback.json",
      "load": 66,
      "model": "sonnet",
      "accent": "red"
    },
    {
      "id": "kr",
      "name": "KR Writer",
      "origin": "Claude",
      "role": "한국어 롱폼",
      "team": "Content",
      "status": "idle",
      "task": "프리셋 대기 · 다음 원고 큐 비어 있음",
      "output": "index.ko.md",
      "load": 47,
      "model": "opus",
      "accent": "purple"
    },
    {
      "id": "locale",
      "name": "Locale Adapter",
      "origin": "Claude",
      "role": "다국어 각색",
      "team": "Content",
      "status": "idle",
      "task": "KR 원문 → EN/JP/ZH-TW 각색 대기",
      "output": "index.<locale>.md",
      "load": 38,
      "model": "opus",
      "accent": "orange"
    },
    {
      "id": "a11y",
      "name": "A11y Auditor",
      "origin": "Codex",
      "role": "기계적 검증",
      "team": "Engineering",
      "status": "active",
      "task": "axe · lighthouse · spec 검증 실행",
      "output": "deterministic.json",
      "load": 82,
      "model": "haiku",
      "accent": "yellow"
    },
    {
      "id": "image",
      "name": "Codex Image",
      "origin": "Codex",
      "role": "이미지 생성",
      "team": "Engineering",
      "status": "idle",
      "task": "gen-image 큐 대기",
      "output": "generated/*.png",
      "load": 29,
      "model": "sonnet",
      "accent": "pink"
    }
  ],
  "events": []
}
